{
  "schemaVersion": 1,
  "id": "istoreos-remote-control",
  "title": "Control an iStoreOS device remotely",
  "platform": "istoreos",
  "mode": "remote-control",
  "aliases": [],
  "path": ".",
  "skillsRoot": "skills",
  "generated": true,
  "generatedFrom": [
    "common",
    "linux",
    "openwrt",
    "istoreos",
    "transport.ssh",
    "transport.luci-http"
  ],
  "componentVersions": {
    "common": "1.0.0",
    "linux": "1.0.0",
    "openwrt": "1.0.0",
    "istoreos": "2.0.0",
    "transport.ssh": "1.1.0",
    "transport.luci-http": "1.0.0"
  },
  "sourceDigest": "sha256:ee223848e036a5f2d998cc0eac318218b7366f49da9ba59ffea352f3fc1d6983",
  "treeDigest": "sha256:3a0d10931db9db93b21e56121990b3c70c3c6f94efb9a7175adac15984ac6190"
}
