{
  "schemaVersion": 1,
  "id": "istoreos-on-device",
  "title": "Use an agent on an iStoreOS device",
  "platform": "istoreos",
  "mode": "on-device",
  "aliases": [],
  "path": ".",
  "skillsRoot": "skills",
  "generated": true,
  "generatedFrom": [
    "common",
    "linux",
    "openwrt",
    "istoreos"
  ],
  "componentVersions": {
    "common": "1.0.0",
    "linux": "1.0.0",
    "openwrt": "1.0.0",
    "istoreos": "2.0.0"
  },
  "sourceDigest": "sha256:d9e181ae8025ad34bb924db7b772d95ab0ae8fa3ba035d722c9c92e3eaac9643",
  "treeDigest": "sha256:df48daa0ebbaced37a7da859785b3ea8b2a6744ab51634fec4ae13f055b71826"
}
